{
  "task_id": "spice_deck_debug_0010",
  "domain": "spice_deck_debug",
  "task_family": "syntax_error",
  "expected_error_category": "missing_model",
  "difficulty": "medium",
  "tags": [
    "syntax",
    "missing-model",
    "mosfet"
  ],
  "prompt_file": "prompt.md",
  "visible_files": [
    "visible/spice_deck_debug_0010_bug.sp"
  ],
  "hidden_files": [
    "hidden/spice_deck_debug_0010_fixed.sp"
  ],
  "expected_outputs": [
    "spice_deck_debug_0010_fixed.sp"
  ],
  "grader": {
    "type": "exact_match",
    "criteria": "Fixed SPICE deck must be functionally equivalent to oracle solution"
  },
  "timeout_sec": 300,
  "license_notes": "Apache-2.0, synthetic content",
  "generation_source": "synthetic",
  "oracle_description": "Fix model name from `nmos_bad` to `nmos`, add `.model nmos nmos (level=1 vto=0.7 kp=120u)`.",
  "validation_status": "debug_contrast_verified",
  "optional_tool_backends": [
    "hspice",
    "spectre"
  ],
  "public_release_safe": true
}