{
  "task_id": "spice_deck_debug_0078",
  "domain": "spice_deck_debug",
  "task_family": "syntax_error",
  "expected_error_category": "unsupported_dialect",
  "difficulty": "hard",
  "tags": [
    "syntax",
    "invalid-level",
    "mosfet"
  ],
  "prompt_file": "prompt.md",
  "visible_files": [
    "visible/spice_deck_debug_0078_bug.sp"
  ],
  "hidden_files": [
    "hidden/spice_deck_debug_0078_fixed.sp"
  ],
  "expected_outputs": [
    "spice_deck_debug_0078_fixed.sp"
  ],
  "grader": {
    "type": "exact_match",
    "criteria": "Fixed SPICE deck must be functionally equivalent to oracle solution"
  },
  "timeout_sec": 300,
  "license_notes": "Apache-2.0, synthetic content",
  "generation_source": "synthetic",
  "oracle_description": "Change `level=99` to `level=1` in the .model statement.",
  "validation_status": "candidate_unvalidated",
  "optional_tool_backends": [
    "hspice",
    "spectre"
  ],
  "public_release_safe": true
}