{
  "task_id": "spice_deck_debug_0056",
  "domain": "spice_deck_debug",
  "task_family": "syntax_error",
  "expected_error_category": "wrong_pin_count",
  "difficulty": "hard",
  "tags": [
    "wrong-pins",
    "syntax",
    "subcircuit"
  ],
  "prompt_file": "prompt.md",
  "visible_files": [
    "visible/spice_deck_debug_0056_bug.sp"
  ],
  "hidden_files": [
    "hidden/spice_deck_debug_0056_fixed.sp"
  ],
  "expected_outputs": [
    "spice_deck_debug_0056_fixed.sp"
  ],
  "grader": {
    "type": "exact_match",
    "criteria": "Fixed SPICE deck must be functionally equivalent to oracle solution"
  },
  "timeout_sec": 300,
  "license_notes": "Apache-2.0, synthetic content",
  "generation_source": "synthetic",
  "oracle_description": "Add missing `gnd` pin: change `X1 a b out vdd nor2` to `X1 a b out vdd gnd nor2`.",
  "validation_status": "debug_contrast_verified",
  "optional_tool_backends": [
    "hspice",
    "spectre"
  ],
  "public_release_safe": true
}