{
  "task_id": "spice_deck_debug_0037",
  "domain": "spice_deck_debug",
  "task_family": "syntax_error",
  "expected_error_category": "duplicate_element",
  "difficulty": "medium",
  "tags": [
    "syntax",
    "duplicate",
    "mosfet"
  ],
  "prompt_file": "prompt.md",
  "visible_files": [
    "visible/spice_deck_debug_0037_bug.sp"
  ],
  "hidden_files": [
    "hidden/spice_deck_debug_0037_fixed.sp"
  ],
  "expected_outputs": [
    "spice_deck_debug_0037_fixed.sp"
  ],
  "grader": {
    "type": "exact_match",
    "criteria": "Fixed SPICE deck must be functionally equivalent to oracle solution"
  },
  "timeout_sec": 300,
  "license_notes": "Apache-2.0, synthetic content",
  "generation_source": "synthetic",
  "oracle_description": "Rename duplicate `M2` to `M3`.",
  "validation_status": "debug_contrast_verified",
  "optional_tool_backends": [
    "hspice",
    "spectre"
  ],
  "public_release_safe": true
}